{
  "api_version": 1,
  "description": "Docs-sync map: the source of truth for AGENTS.md § Docs in sync (regenerate the table with `make docs-sync-table`). A rule fires when a changed path matches its gate/advisory trigger; it is satisfied when some other changed path matches one of its `docs` globs. `gate` rules fail `docs_sync.py check` in CI; `advisory` rules (including every row with no trigger yet) only report. Waive with the commit trailer `Docs-Sync-Waive: <id> <reason>`.",
  "ignore": [
    "**/*.test.*",
    "**/*.stories.*",
    "uv.lock",
    "gui/web/package-lock.json",
    "tests/"
  ],
  "rules": [
    {
      "id": "layers-packages-or-service-boundaries",
      "when": "Layers, packages, or service boundaries",
      "update": "`docs/architecture.md`",
      "docs": [
        "docs/architecture.md"
      ],
      "advisory": null
    },
    {
      "id": "source-timeline-timebase-sessiontimeline-or",
      "when": "Source/timeline timebase, `SessionTimeline`, or clip time math",
      "update": "`docs/architecture.md` § Timebase (owner; it links the format, contributing and testing docs), affected skills",
      "docs": [
        "docs/architecture.md"
      ],
      "advisory": {
        "include": [
          "src/podcast_mcp/util/timebase.py",
          "src/podcast_mcp/util/tool_timebase.py",
          "src/podcast_mcp/engines/session_timeline.py",
          "src/podcast_mcp/engines/timemap.py",
          "src/podcast_mcp/engines/session_clock.py",
          "src/podcast_mcp/edits/timeline_span.py",
          "src/podcast_mcp/edits/transcript_sync.py",
          "gui/web/src/utils/timebase.ts"
        ]
      }
    },
    {
      "id": "setup-commands-or-repo-layout",
      "when": "Setup, commands, or repo layout",
      "update": "`README.md`, `docs/setup.md`",
      "docs": [
        "README.md",
        "docs/setup.md"
      ],
      "advisory": {
        "include": [
          "Makefile",
          "install.sh",
          "scripts/worktree-setup.sh",
          ".githooks/pre-commit",
          ".nvmrc",
          "src/podcast_mcp/cli/main.py"
        ]
      }
    },
    {
      "id": "python-deps",
      "when": "Python dependencies (add/remove/bump)",
      "update": "`pyproject.toml`, then regenerate `uv.lock` (`uv lock`), `docs/setup.md`",
      "docs": [
        "pyproject.toml",
        "uv.lock",
        "docs/setup.md"
      ],
      "advisory": {
        "include": [
          "pyproject.toml"
        ]
      }
    },
    {
      "id": "contributor-workflow",
      "when": "Contributor workflow",
      "update": "`docs/contributing.md`, this file",
      "docs": [
        "docs/contributing.md"
      ],
      "advisory": null
    },
    {
      "id": "mcp-tools-or-nl-social-workflows",
      "when": "MCP tools or NL/social workflows",
      "update": "`docs/nl-editing.md`, `docs/transcript-workflow.md`, `docs/social-clips.md`, `docs/timeline-comments.md`, relevant `.agents/skills/` (incl. `podcast-transcript-workflow`, `podcast-play-audition`, `podcast-timeline-comments`)",
      "docs": [
        "docs/nl-editing.md",
        "docs/transcript-workflow.md",
        "docs/social-clips.md",
        "docs/timeline-comments.md",
        ".agents/skills/"
      ],
      "gate": {
        "include": [
          "src/podcast_mcp/mcp/tools/",
          "src/podcast_mcp/mcp/server.py",
          "src/podcast_mcp/clips/",
          "src/podcast_mcp/services/document/clip.py"
        ],
        "exclude": [
          "src/podcast_mcp/mcp/tools/guest/",
          "src/podcast_mcp/mcp/tools/agent_notify.py"
        ]
      }
    },
    {
      "id": "prosody-profile",
      "when": "Prosody profile (`analyze_prosody` step, cache, engine, `audition_context` fields)",
      "update": "`docs/pipeline.md` § Prosody profile, `docs/persistence.md`, `docs/architecture.md`, `docs/setup.md` (extras), `docs/testing.md` (CI extras), `docs/nl-editing.md` (`audition_context_tool` row), `.agents/defaults/pipeline.yaml`, skills `podcast-play-audition`, `podcast-pipeline-run`, `podcast-pipeline-tune`, `podcast-setup`",
      "docs": [
        "docs/pipeline.md",
        "docs/persistence.md",
        "docs/architecture.md",
        "docs/setup.md",
        "docs/testing.md",
        "docs/testing-ci.md",
        "docs/nl-editing.md",
        ".agents/defaults/pipeline.yaml"
      ],
      "gate": {
        "include": [
          "src/podcast_mcp/engines/prosody.py",
          "src/podcast_mcp/edits/prosody_profile.py",
          "src/podcast_mcp/edits/audition_context.py",
          "gui/web/src/prosody/",
          "gui/web/src/api/prosody.ts",
          "gui/web/src/types/prosody.ts"
        ]
      }
    },
    {
      "id": "timeline-review-comments-action-items",
      "when": "Timeline review comments / action items",
      "update": "`docs/timeline-comments.md`, `docs/episode-format-v2.md` § Review, `schemas/episode.project.schema.json`, `.agents/skills/podcast-timeline-comments/`",
      "docs": [
        "docs/timeline-comments.md",
        "docs/episode-format-v2.md",
        "schemas/episode.project.schema.json",
        ".agents/skills/podcast-timeline-comments/"
      ],
      "advisory": {
        "include": [
          "src/podcast_mcp/edits/comments.py",
          "src/podcast_mcp/edits/comment_remap.py",
          "src/podcast_mcp/services/document/comment.py",
          "src/podcast_mcp/mcp/tools/comments.py",
          "src/podcast_mcp/gui/routes/comments.py",
          "src/podcast_mcp/cli/comment.py",
          "src/podcast_mcp/services/document_sync/handlers/comments.py",
          "gui/web/src/comments/",
          "gui/web/src/api/comments.ts",
          "gui/web/src/inspector/views/CommentInspector.tsx"
        ]
      }
    },
    {
      "id": "public-share-tokens",
      "when": "Public share tokens (coolname, active + cooldown pools)",
      "update": "`docs/share-tokens.md`, `podcast review backup-registry`",
      "docs": [
        "docs/share-tokens.md"
      ],
      "advisory": {
        "include": [
          "src/podcast_mcp/edits/share_registry.py",
          "src/podcast_mcp/edits/review_shares.py",
          "src/podcast_mcp/services/collaboration/share.py",
          "src/podcast_mcp/cli/review.py",
          "src/podcast_mcp/util/registry_privacy_error.py",
          "src/podcast_mcp/util/review_privacy_error.py"
        ],
        "exclude": [
          "src/podcast_mcp/services/collaboration/share.py"
        ]
      }
    },
    {
      "id": "recording-session",
      "when": "Recording session (record links, roles incl. producer, lobby/consent, keeper capture, mix-minus monitor, pause/takes, live comments, upload/landing)",
      "update": "`docs/recording-session.md` (owner: decisions, test contract MM1–MM9, and links to the share-token, persistence, session-sync, live-comment and guest-journey docs)",
      "docs": [
        "docs/recording-session.md"
      ],
      "advisory": {
        "include": [
          "src/podcast_mcp/services/record/",
          "src/podcast_mcp/services/collaboration/record_share.py",
          "src/podcast_mcp/gui/routes/record_host.py",
          "src/podcast_mcp/gui/routes/record_share.py",
          "src/podcast_mcp/gui/routes/record_upload_http.py",
          "src/podcast_mcp/mcp/tools/record.py",
          "src/podcast_mcp/cli/record.py",
          "gui/web/src/record/",
          "gui/web/src/audio/mixMinus.ts",
          "gui/web/src/api/sharesRecord.ts",
          "gui/web/src/styles/partials/record.css",
          "gui/web/src/styles/partials/record-entry.css"
        ]
      }
    },
    {
      "id": "durable-stores",
      "when": "Durable stores (project JSON, session sync sqlite, share registry, cache `prefs.yaml`)",
      "update": "`docs/persistence.md` — extend an existing store; do not scatter new sidecars. Episode `artifacts/transcript_context.yaml.lock` only coordinates writers; the vocabulary revision lives in context YAML and each transcript's `vocabulary_revision` in project JSON.",
      "docs": [
        "docs/persistence.md"
      ],
      "advisory": {
        "include": [
          "src/podcast_mcp/project_store.py",
          "src/podcast_mcp/project_io.py",
          "src/podcast_mcp/project_merge.py",
          "src/podcast_mcp/transcript_context.py",
          "src/podcast_mcp/whisper_models.py",
          "src/podcast_mcp/util/atomic_json.py",
          "src/podcast_mcp/util/project_state.py",
          "src/podcast_mcp/util/object_store.py",
          "src/podcast_mcp/util/sqlite_tx.py",
          "src/podcast_mcp/util/file_locks.py",
          "src/podcast_mcp/services/session_sync/sqlite.py",
          "src/podcast_mcp/services/session_sync/log.py",
          "src/podcast_mcp/services/share_auth/store.py",
          "src/podcast_mcp/services/media/media_store.py",
          "src/podcast_mcp/edits/share_registry.py"
        ]
      }
    },
    {
      "id": "daw-viewer-launch",
      "when": "DAW viewer launch (`open_gui_tool`)",
      "update": "`docs/gui-viewer.md` § Launch, `docs/setup.md` § Read-only GUI viewer, skill `podcast-open-gui`",
      "docs": [
        "docs/gui-viewer.md",
        "docs/setup.md"
      ],
      "advisory": {
        "include": [
          "src/podcast_mcp/services/app/gui_launch.py",
          "src/podcast_mcp/mcp/tools/gui.py",
          "src/podcast_mcp/cli/gui.py"
        ]
      }
    },
    {
      "id": "undo-non-destructive-mutations",
      "when": "Undo / non-destructive mutations",
      "update": "`docs/history.md`, `docs/gui-integration.md`, `docs/contributing.md` § History, `.agents/INSTRUCTIONS.md`, `.agents/rules/engineering-standards.md`",
      "docs": [
        "docs/history.md",
        "docs/gui-integration.md",
        "docs/contributing.md",
        ".agents/INSTRUCTIONS.md",
        ".agents/rules/engineering-standards.md"
      ],
      "gate": {
        "include": [
          "src/podcast_mcp/history/",